Sheet: Comparatif coÃ»ts OR et CF
A1: DOSSIER 18 | B1: dossier 18 | F1: of:=+[.A1] -> DOSSIER 18 | K1: ECARTS - CLIENT OR | Q1: ANALYSE ECARTS - CLIENT OR
A2: COÃT PREETABLI - CLIENT OR | F2: COÃT REEL - CLIENT OR | L2: of:=[.A1] -> DOSSIER 18 | Q2: DOSSIER 18
K3: ElÃ©ments | L3: PrÃ©Ã©tabli | M3: RÃ©el | N3: Ecarts | Q3: ElÃ©ments | R3: PrÃ©Ã©tabli | S3: Ecarts | U3: dÃ©composition dÃ©s Ã©carts
A4: ElÃ©ments | B4: Global | C4: RÃ©partition | D4: Montant | F4: ElÃ©ments | G4: Global | H4: RÃ©partition | I4: Montant | M4: RÃ©el | N4: Favorable | O4: DÃ©favorable | S4: Favorable | T4: DÃ©favorable | U4: SIGNIFICATIF | AK4: E/V | AL4: EG | AM4: - | AN4: E/Q | AO4: E/C
A6: Charges directes | F6: Charges directes | K6: Charges directes | Q6: Charges directes
A7: - Film | D7: 280 | F7: - Film | I7: 300 | K7: - Film | L7: 280 | M7: 300 | N7: of:=IF([.M7]>=[.L7];" ";[.L7]-[.M7]) ->   | O7: of:=IF([.M7]>[.L7];[.M7]-[.L7];" ") -> 20 | Q7: - Film | R7: 280 | T7: 20 | U7: of:=IF(AND([.T7]>1000;[.T7]/[.R7]>0.1);"x";"N") -> N
A8: - Carton | D8: 3000 | F8: - Carton | I8: 3200 | K8: - Carton | L8: 3000 | M8: 3200 | N8: of:=IF([.M8]>=[.L8];" ";[.L8]-[.M8]) ->   | O8: of:=IF([.M8]>[.L8];[.M8]-[.L8];" ") -> 200 | Q8: - Carton | R8: 3000 | T8: 200 | U8: of:=IF(AND([.T8]>1000;[.T8]/[.R8]>0.1);"x";"N") -> N
A9: - Consommables | D9: 20 | F9: - Consommables | I9: 50 | K9: - Consommables | L9: 20 | M9: 50 | N9: of:=IF([.M9]>=[.L9];" ";[.L9]-[.M9]) ->   | O9: of:=IF([.M9]>[.L9];[.M9]-[.L9];" ") -> 30 | Q9: - Consommables | R9: 20 | T9: 30 | U9: of:=IF(AND([.T9]>1000;[.T9]/[.R9]>0.1);"x";"N") -> N
A10: - Imprimeur | D10: 6000 | F10: - Imprimeur | I10: 6000 | K10: - Imprimeur | L10: 6000 | M10: 6000 | N10: of:=IF([.M10]>=[.L10];" ";[.L10]-[.M10]) ->   | O10: of:=IF([.M10]>[.L10];[.M10]-[.L10];" ") ->   | Q10: - Imprimeur | R10: 6000
A11: - Transport | D11: 750 | F11: - Transport | I11: 750 | K11: - Transport | L11: 750 | M11: 750 | N11: of:=IF([.M11]>=[.L11];" ";[.L11]-[.M11]) ->   | O11: of:=IF([.M11]>[.L11];[.M11]-[.L11];" ") ->   | Q11: - Transport | R11: 750
N12: of:=IF([.M12]>=[.L12];" ";[.L12]-[.M12]) ->   | O12: of:=IF([.M12]>[.L12];[.M12]-[.L12];" ") ->   | U12: SIGNIFICATIF | V12: cp | W12: cv | X12: CF | Y12: nuo_p/pdt | Z12: nuo_r/pdt | AA12: Nuo_r | AC12: production | AD12: unitÃ© c | AE12: unitÃ© q | AG12: pr | AH12: CPPR | AI12: BFAR | AJ12: CPAR | AK12: E/V | AL12: EG | AM12: E/B | AN12: E/R | AO12: E/A
A13: Charges indirectes | F13: Charges indirectes | K13: Charges indirectes | N13: of:=IF([.M13]>=[.L13];" ";[.L13]-[.M13]) ->   | O13: of:=IF([.M13]>[.L13];[.M13]-[.L13];" ") ->   | Q13: Charges indirectes | V13: '=montant_assiette_centre_analyse / nb_uo | AA13: '=nuo_r/pdtxPR | AE13: 'unitÃ© de consoÂ ? | AH13: '=(Cuo PrÃ©Ã©tabli x Nuo par produit) x PR | AI13: '=Charges Variables Unitaires x Nuo RÃ©el + CF Totales | AJ13: '=Cuo PrÃ©Ã©tabli x Nuo RÃ©el | AK13: 'CPPR-CPPP | AL13: 'CRPR-CPPR | AM13: 'CRPR-BFAR | AN13: 'CPAR-CPPR | AO13: 'BFAR-CPAR
A14: - Autres charges | B14: 60000 | C14: cteÂ dos. : 1 dossier / tot annuel p | D14: of:=[.B14]*1/20 -> 3000 | F14: - Autres charges | G14: 9634 | H14: Cte dosÂ : 1 dossier / 2 dos | I14: of:=[.G14]*1/2 -> 4817 | K14: - Autres charges | L14: 3000 | M14: 4817 | N14: of:=IF([.M14]>=[.L14];" ";[.L14]-[.M14]) ->   | O14: of:=IF([.M14]>[.L14];[.M14]-[.L14];" ") -> 1817 | Q14: - Autres charges | R14: 3000 | T14: 1817 | U14: of:=IF(AND([.T14]>1000;[.T14]/[.R14]>0.1);"x";"N") -> x | V14: of:=[.B14]/20 -> 3000 | W14: ? | X14: ? | Y14: 1 | Z14: 1 | AA14: of:=[.Z14]*[.AG14] -> 1 | AC14: 1 dossier | AD14: eu/dossier | AE14: 1 u/dossier | AG14: 1 | AH14: of:=[.V14]*[.Y14]*[.AG14] -> 3000 | AI14: ? | AJ14: of:=[.V14]*[.AA14] -> 3000 | AK14: of:=[.AH14]-[.R14] -> 0 | AL14: of:=[.M14]-[.AH14] -> 1817 | AN14: of:=[.AJ14]-[.AH14] -> 0
A15: - Administration | B15: 115440 | C15: Cte dos Â : 40keCA / tot annuel p | D15: of:=[.B15]*40000/800000 -> 5772 | F15: - Administration | G15: 19240 | H15: ca ce dossier / ca tot 2 dos | I15: of:=[.G15]*35000/95000 -> 7088.42105263158 | K15: - Administration | L15: 5772 | M15: 7088.42105263158 | N15: of:=IF([.M15]>=[.L15];" ";[.L15]-[.M15]) ->   | O15: of:=IF([.M15]>[.L15];[.M15]-[.L15];" ") -> 1316.42105263158 | Q15: - Administration | R15: 5772 | T15: 1316.42105263158 | U15: of:=IF(AND([.T15]>1000;[.T15]/[.R15]>0.1);"x";"N") -> x | V15: of:=[.B15]/800000 -> 0.1443 | W15: ? | X15: ? | Y15: 40000 | Z15: 35000 | AA15: of:=[.Z15]*[.AG15] -> 35000 | AC15: 1 dossier | AD15: eu/euca | AE15: euca/dossier | AG15: 1 | AH15: of:=[.V15]*[.Y15]*[.AG15] -> 5772 | AI15: ? | AJ15: of:=[.V15]*[.AA15] -> 5050.5 | AK15: of:=[.AH15]-[.R15] -> 0 | AL15: of:=[.M15]-[.AH15] -> 1316.42105263158 | AN15: of:=[.AJ15]-[.AH15] -> -721.500000000001
A16: - Conception | B16: 99160 | C16: 10 jours conception / tot annuel | D16: of:=[.B16]*10/360 -> 2754.44444444444 | F16: - Conception | G16: 16576 | H16: jours conception / jour tot 2 dos | I16: of:=34/57*[.G16] -> 9887.43859649123 | K16: - Conception | L16: 2754.44444444444 | M16: 9887.43859649123 | N16: of:=IF([.M16]>=[.L16];" ";[.L16]-[.M16]) ->   | O16: of:=IF([.M16]>[.L16];[.M16]-[.L16];" ") -> 7132.99415204678 | Q16: - Conception | R16: 2754.44444444444 | T16: 7132.99415204678 | U16: of:=IF(AND([.T16]>1000;[.T16]/[.R16]>0.1);"x";"N") -> x | V16: of:=[.B16]/360 -> 275.444444444444 | W16: ? | X16: ? | Y16: 10 | Z16: 34 | AA16: of:=[.Z16]*[.AG16] -> 34 | AC16: 1 dossier | AD16: eu/jconcep | AE16: jconcep/dossier | AG16: 1 | AH16: of:=[.V16]*[.Y16]*[.AG16] -> 2754.44444444444 | AI16: ? | AJ16: of:=[.V16]*[.AA16] -> 9365.11111111111 | AK16: of:=[.AH16]-[.R16] -> 0 | AL16: of:=[.M16]-[.AH16] -> 7132.99415204678 | AN16: of:=[.AJ16]-[.AH16] -> 6610.66666666667
A17: - Production | B17: 97680 | C17: 30k affiches cmdÃ©es/ tot annuel p | D17: of:=[.B17]*30000/500000 -> 5860.8 | F17: - Production | G17: 17316 | H17: affiches ce dos / affiches tot 2 dos | I17: of:=[.G17]*30500/55700 -> 9481.83123877917 | K17: - Production | L17: 5860.8 | M17: 9481.83123877917 | N17: of:=IF([.M17]>=[.L17];" ";[.L17]-[.M17]) ->   | O17: of:=IF([.M17]>[.L17];[.M17]-[.L17];" ") -> 3621.03123877917 | Q17: - Production | R17: 5860.8 | T17: 3621.03123877917 | U17: of:=IF(AND([.T17]>1000;[.T17]/[.R17]>0.1);"x";"N") -> x | V17: of:=[.B17]/500000 -> 0.19536 | W17: ? | X17: ? | Y17: 1 | Z17: 1 | AA17: of:=[.Z17]*[.AG17] -> 30500 | AC17: affiches/dossier | AD17: eu/affiche | AE17: dossier | AG17: 30500 | AH17: of:=[.V17]*[.Y17]*[.AG17] -> 5958.48 | AI17: ? | AJ17: of:=[.V17]*[.AA17] -> 5958.48 | AK17: of:=[.AH17]-[.R17] -> 97.6800000000003 | AL17: of:=[.M17]-[.AH17] -> 3523.35123877917 | AN17: of:=[.AJ17]-[.AH17] -> 0
N18: of:=IF([.M18]>=[.L18];" ";[.L18]-[.M18]) ->   | O18: of:=IF([.M18]>[.L18];[.M18]-[.L18];" ") ->  
A19: Amortissements | B19: 20128 | C19: Cte dosÂ : 1 dossier / tot annuel p | D19: of:=[.B19]*1/20 -> 1006.4 | F19: Amortissements | G19: 20128 | H19: cte dosÂ : 1 dossier / tot annuel r | I19: of:=[.G19]/19 -> 1059.36842105263 | K19: Amortissements | L19: 1006.4 | M19: 1059.36842105263 | N19: of:=IF([.M19]>=[.L19];" ";[.L19]-[.M19]) ->   | O19: of:=IF([.M19]>[.L19];[.M19]-[.L19];" ") -> 52.9684210526317 | Q19: Amortissements | R19: 1006.4 | T19: 52.9684210526317 | U19: of:=IF(AND([.T19]>1000;[.T19]/[.R19]>0.1);"x";"N") -> N
O20: of:=IF([.M20]>[.L20];[.M20]-[.L20];" ") ->  
A21: COÃT PREETABLI | D21: of:=SUM([.D7:.D19]) -> 28443.6444444444 | F21: COÃT REEL | I21: of:=SUM([.I7:.I19]) -> 42634.0593089546 | K21: TOTAUX | L21: of:=SUM([.L6:.L19]) -> 28443.6444444444 | M21: of:=SUM([.M7:.M19]) -> 42634.0593089546 | N21: of:=IF([.M21]>=[.L21];" ";[.L21]-[.M21]) ->   | O21: of:=IF([.M21]>[.L21];[.M21]-[.L21];" ") -> 14190.4148645102
K22: Chiffre d'affaires | L22: 40000 | M22: 35000 | O22: of:=[.L22]-[.M22] -> 5000
K23: RESULTAT | L23: of:=[.L22]-[.L21] -> 11556.3555555556 | M23: of:=[.M22]-[.M21] -> -7634.05930895462 | O23: of:=[.L23]-[.M23] -> 19190.4148645102
A27: DOSSIER 19 | B27: dossier 18 | F27: DOSSIER 19 | K27: ECARTS - CLIENT CF | Q27: ANALYSE ECARTS - CLIENT CF
A28: COÃT PREETABLI - CLIENT CF | C28: 1006.4 | D28: 1006.4 | F28: COÃT REEL - CLIENT CF | L28: of:=[.F27] -> DOSSIER 19 | Q28: DOSSIER 19
K29: ElÃ©ments | L29: PrÃ©Ã©tabli | M29: RÃ©el | N29: Ecarts | Q29: ElÃ©ments | R29: PrÃ©Ã©tabli | S29: Ecarts | U29: dÃ©composition dÃ©s Ã©carts
A30: ElÃ©ments | B30: Global | C30: RÃ©partition | D30: Montant | F30: ElÃ©ments | G30: Global | H30: RÃ©partition | I30: Montant | M30: RÃ©el | N30: Favorable | O30: DÃ©favorable | S30: Favorable | T30: DÃ©favorable | U30: SIGNIFICATIF | V30: QR | W30: QP | X30: cr | Y30: cp | AA30: CRPR | AB30: CPPR | AC30: conso | AD30: unitÃ© c | AE30: unitÃ© q | AF30: CPPP | AG30: PR | AH30: CPPR | AK30: E/V | AL30: EG | AM30: - | AN30: E/Q | AO30: E/C
AA31: '=QrxCr | AB31: '=QrxCp | AH31: '=(Cuo PrÃ©Ã©tabli x Nuo par produit) x PR | AL31: 'C(CCR)PV-C(cP)PV | AN31: '(Qr-Qp)cp | AO31: '(cr-cp)Qr
A32: Charges directes | F32: Charges directes | K32: Charges directes | Q32: Charges directes
A33: - Film | D33: 350 | F33: - Film | I33: 372 | K33: - Film | L33: 350 | M33: 372 | N33: of:=IF([.M33]>=[.L33];" ";[.L33]-[.M33]) ->   | O33: of:=IF([.M33]>[.L33];[.M33]-[.L33];" ") -> 22 | Q33: - Film | R33: 280 | T33: 22 | U33: of:=IF(AND([.T33]>1000;[.T33]/[.R33]>0.1);"x";"N") -> N | X33: '=M34/V34
A34: - Carton | D34: of:=0.12*25000 -> 3000 | F34: - Carton | I34: 4050 | K34: - Carton | L34: 3000 | M34: of:=[.I34] -> 4050 | N34: of:=IF([.M34]>=[.L34];" ";[.L34]-[.M34]) ->   | O34: of:=IF([.M34]>[.L34];[.M34]-[.L34];" ") -> 1050 | Q34: - Carton | R34: 3000 | T34: of:=[.O34] -> 1050 | U34: of:=IF(AND([.T34]>1000;[.T34]/[.R34]>0.1);"x";"N") -> x | V34: 27000 | W34: 25000 | X34: 0.15 | Y34: 0.12 | AA34: of:=[.V34]*[.X34] -> 4050 | AB34: of:=[.V34]*[.Y34] -> 3240 | AC34: 1 carton | AD34: eu/carton | AE34: 1 | AF34: of:=[.Y34]*[.W34] -> 3000 | AH34: of:=[.Y34]*[.V34] -> 3240 | AL34: of:=[.AA34]-[.AF34] -> 1050 | AN34: of:=([.V34]-[.W34])*[.Y34] -> 240 | AO34: of:=([.X34]-[.Y34])*[.V34] -> 810
A35: - Consommables | D35: 60 | F35: - Consommables | I35: 50 | K35: - Consommables | L35: 60 | M35: 50 | N35: of:=IF([.M35]>=[.L35];" ";[.L35]-[.M35]) -> 10 | O35: of:=IF([.M35]>[.L35];[.M35]-[.L35];" ") ->   | Q35: - Consommables | R35: 20 | S35: 10 | U35: of:=IF(AND([.T35]>1000;[.T35]/[.R35]>0.1);"x";"N") -> N
A36: - Imprimeur | D36: 6800 | F36: - Imprimeur | I36: 6800 | K36: - Imprimeur | L36: 6800 | M36: 6800 | N36: of:=IF([.M36]>=[.L36];" ";[.L36]-[.M36]) ->   | O36: of:=IF([.M36]>[.L36];[.M36]-[.L36];" ") ->   | Q36: - Imprimeur | R36: 6000
A37: - Transport | D37: 820 | F37: - Transport | I37: 820 | K37: - Transport | L37: 820 | M37: 820 | N37: of:=IF([.M37]>=[.L37];" ";[.L37]-[.M37]) ->   | O37: of:=IF([.M37]>[.L37];[.M37]-[.L37];" ") ->   | Q37: - Transport | R37: 750
N38: of:=IF([.M38]>=[.L38];" ";[.L38]-[.M38]) ->   | O38: of:=IF([.M38]>[.L38];[.M38]-[.L38];" ") ->   | U38: SIGNIFICATIF | V38: cp | W38: cv | X38: CF | Y38: nuo_p/pdt | Z38: nuo_r/pdt | AA38: Nuo_r | AC38: production | AD38: unitÃ© c | AE38: unitÃ© q | AG38: pr | AH38: CPPR | AI38: BFAR | AJ38: CPAR | AK38: E/V | AL38: EG | AM38: E/B | AN38: E/R | AO38: E/A
A39: Charges indirectes | F39: Charges indirectes | K39: Charges indirectes | N39: of:=IF([.M39]>=[.L39];" ";[.L39]-[.M39]) ->   | O39: of:=IF([.M39]>[.L39];[.M39]-[.L39];" ") ->   | Q39: Charges indirectes | V39: '=montant_assiette_centre_analyse / nb_uo | AA39: '=nuo_r/pdtxPR | AE39: 'unitÃ© de consoÂ ? | AH39: '=(Cuo PrÃ©Ã©tabli x Nuo par produit) x PR | AI39: '=Charges Variables Unitaires x Nuo RÃ©el + CF Totales | AJ39: '=Cuo PrÃ©Ã©tabli x Nuo RÃ©el | AK39: 'CPPR-CPPP | AL39: 'CRPR-CPPR | AM39: 'CRPR-BFAR | AN39: 'CPAR-CPPR | AO39: 'BFAR-CPAR
A40: - Autres charges | B40: 60000 | C40: cte dos : 1 dossier / tot annuel p | D40: of:=[.B40]*1/20 -> 3000 | F40: - Autres charges | G40: 9634 | H40: Cte dosÂ : 1 dossier / 2 dos | I40: of:=[.G40]*1/2 -> 4817 | K40: - Autres charges | L40: 3000 | M40: 4817 | N40: of:=IF([.M40]>=[.L40];" ";[.L40]-[.M40]) ->   | O40: of:=IF([.M40]>[.L40];[.M40]-[.L40];" ") -> 1817 | Q40: - Autres charges | R40: 3000 | T40: 1817 | U40: of:=IF(AND([.T40]>1000;[.T40]/[.R40]>0.1);"x";"N") -> x | V40: of:=[.B40]/20 -> 3000 | W40: ? | X40: ? | Y40: 1 | Z40: 1 | AA40: of:=[.Z40]*[.AG40] -> 1 | AC40: 1 dossier | AD40: eu/dossier | AE40: 1 u/dossier | AG40: 1 | AH40: of:=[.V40]*[.Y40]*[.AG40] -> 3000 | AJ40: of:=[.V40]*[.AA40] -> 3000 | AK40: of:=[.AH40]-[.R40] -> 0 | AL40: of:=[.M40]-[.AH40] -> 1817 | AN40: of:=[.AJ40]-[.AH40] -> 0
A41: - Administration | B41: 115440 | C41: cte dos : 40keCA / tot annuel p | D41: of:=[.B41]*40000/800000 -> 5772 | F41: - Administration | G41: 19240 | H41: ca ce dossier / ca tot 2 dos | I41: of:=[.G41]*60000/95000 -> 12151.5789473684 | K41: - Administration | L41: 5772 | M41: 12151.5789473684 | N41: of:=IF([.M41]>=[.L41];" ";[.L41]-[.M41]) ->   | O41: of:=IF([.M41]>[.L41];[.M41]-[.L41];" ") -> 6379.57894736842 | Q41: - Administration | R41: 5772 | T41: 6379.57894736842 | U41: of:=IF(AND([.T41]>1000;[.T41]/[.R41]>0.1);"x";"N") -> x | V41: of:=[.B41]/800000 -> 0.1443 | W41: ? | X41: ? | Y41: 40000 | Z41: 35000 | AA41: of:=[.Z41]*[.AG41] -> 35000 | AC41: 1 dossier | AD41: eu/euca | AE41: euca/dossier | AG41: 1 | AH41: of:=[.V41]*[.Y41]*[.AG41] -> 5772 | AJ41: of:=[.V41]*[.AA41] -> 5050.5 | AK41: of:=[.AH41]-[.R41] -> 0 | AL41: of:=[.M41]-[.AH41] -> 6379.57894736842 | AN41: of:=[.AJ41]-[.AH41] -> -721.500000000001
A42: - Conception | B42: 99160 | C42: 12,5 jours conception / tot annuel | D42: of:=[.B42]*12.5/360 -> 3443.05555555556 | F42: - Conception | G42: 16576 | H42: jours conception / jour tot 2 dos | I42: of:=23/57*[.G42] -> 6688.56140350877 | K42: - Conception | L42: 3443.05555555556 | M42: 6688.56140350877 | N42: of:=IF([.M42]>=[.L42];" ";[.L42]-[.M42]) ->   | O42: of:=IF([.M42]>[.L42];[.M42]-[.L42];" ") -> 3245.50584795322 | Q42: - Conception | R42: 2754.44444444444 | T42: 3245.50584795322 | U42: of:=IF(AND([.T42]>1000;[.T42]/[.R42]>0.1);"x";"N") -> x | V42: of:=[.B42]/360 -> 275.444444444444 | W42: ? | X42: ? | Y42: 12.5 | Z42: 23 | AA42: of:=[.Z42]*[.AG42] -> 23 | AC42: 1 dossier | AD42: eu/jconcep | AE42: jconcep/dossier | AG42: 1 | AH42: of:=[.V42]*[.Y42]*[.AG42] -> 3443.05555555556 | AJ42: of:=[.V42]*[.AA42] -> 6335.22222222222 | AK42: of:=[.AH42]-[.R42] -> 688.611111111111 | AL42: of:=[.M42]-[.AH42] -> 3245.50584795322 | AN42: of:=[.AJ42]-[.AH42] -> 2892.16666666667
A43: - Production | B43: 97680 | C43: 25k affiches cmdÃ©es / tot annuel p | D43: of:=[.B43]*25000/500000 -> 4884 | F43: - Production | G43: 17316 | H43: affiches ce dos / affiches tot 2 dos | I43: of:=[.G43]*25200/55700 -> 7834.16876122083 | K43: - Production | L43: 4884 | M43: 7834.16876122083 | N43: of:=IF([.M43]>=[.L43];" ";[.L43]-[.M43]) ->   | O43: of:=IF([.M43]>[.L43];[.M43]-[.L43];" ") -> 2950.16876122083 | Q43: - Production | R43: 5860.8 | T43: 2950.16876122083 | U43: of:=IF(AND([.T43]>1000;[.T43]/[.R43]>0.1);"x";"N") -> x | V43: of:=[.B43]/500000 -> 0.19536 | W43: ? | X43: ? | Y43: 1 | Z43: 1 | AA43: of:=[.Z43]*[.AG43] -> 25200 | AC43: affiches/dossier | AD43: eu/affiche | AE43: dossier | AG43: 25200 | AH43: of:=[.V43]*[.Y43]*[.AG43] -> 4923.072 | AJ43: of:=[.V43]*[.AA43] -> 4923.072 | AK43: of:=[.AH43]-[.R43] -> -937.728 | AL43: of:=[.M43]-[.AH43] -> 2911.09676122083 | AN43: of:=[.AJ43]-[.AH43] -> 0
N44: of:=IF([.M44]>=[.L44];" ";[.L44]-[.M44]) ->   | O44: of:=IF([.M44]>[.L44];[.M44]-[.L44];" ") ->  
A45: Amortissements | B45: 20128 | C45: Cte dos Â : 1 dossier / tot annuel p | D45: of:=[.B45]*1/20 -> 1006.4 | F45: Amortissements | G45: 20128 | H45: cte dos : 1 dossier / tot annuel r | I45: of:=[.G45]/19 -> 1059.36842105263 | K45: Amortissements | L45: 1006.4 | M45: 1059.36842105263 | N45: of:=IF([.M45]>=[.L45];" ";[.L45]-[.M45]) ->   | O45: of:=IF([.M45]>[.L45];[.M45]-[.L45];" ") -> 52.9684210526317 | Q45: Amortissements | R45: 1006.4 | T45: 52.9684210526317 | U45: of:=IF(AND([.T45]>1000;[.T45]/[.R45]>0.1);"x";"N") -> N
A47: COÃT PREETABLI | D47: of:=SUM([.D33:.D45]) -> 29135.4555555556 | F47: COÃT REEL | I47: of:=SUM([.I33:.I45]) -> 44642.6775331507 | K47: TOTAUX | L47: of:=SUM([.L33:.L45]) -> 29135.4555555556 | M47: of:=SUM([.M33:.M45]) -> 44642.6775331507 | N47: of:=SUM([.N32:.N45]) -> 10 | O47: of:=SUM([.O33:.O45]) -> 15517.2219775951
K48: Chiffre d'affaires | L48: 40000 | M48: 60000 | N48: of:=[.M48]-[.L48] -> 20000
K49: RESULTAT | L49: of:=[.L48]-[.L47] -> 10864.5444444444 | M49: of:=[.M48]-[.M47] -> 15357.3224668494 | N49: of:=[.M49]-[.L49] -> 4492.77802240491 | X49: of:=27000*0.15 -> 4050
H71: essai de calcul d'Ã©cart sur qtÃ©Â : | I71: 0.15 | J71: 0.12 | K71: 27000 | L71: 25000
H72: of:=([.K71]-[.L71])*[.J71] -> 240
H73: essais de calcu d'Ã©cart sur cout
H74: of:=([.I71]-[.J71])*[.K71] -> 810
H76: Cr | I76: of:=[.I71]*[.K71] -> 4050
H77: Cp | I77: of:=[.L71]*[.J71] -> 3000
I78: of:=[.I76]-[.I77] -> 1050

Sheet: source_de_donnÃ©es_POSTES_A_ANALYSER
A1: dossier | B1: poste | C1: prÃ©Ã©tabli | D1: Ã©cart | E1: Ã©cart/prÃ©Ã©tabli x 100
A2: ECARTS - CLIENT OR | B2: - Film | C2: 280 | D2: 20 | E2: of:=[.D2]/[.C2] -> 0.0714285714285714
A3: ECARTS - CLIENT OR | B3: - Carton | C3: 3000 | D3: 200 | E3: of:=[.D3]/[.C3] -> 0.0666666666666667
A4: ECARTS - CLIENT OR | B4: - Consommables | C4: 20 | D4: 30 | E4: of:=[.D4]/[.C4] -> 1.5
A5: ECARTS - CLIENT OR | B5: - Imprimeur | C5: 6000 | D5: 0 | E5: of:=[.D5]/[.C5] -> 0
A6: ECARTS - CLIENT OR | B6: - Transport | C6: 750 | D6: 0 | E6: of:=[.D6]/[.C6] -> 0
A7: ECARTS - CLIENT OR | B7: - Autres charges | C7: 3000 | D7: 1817 | E7: of:=[.D7]/[.C7] -> 0.605666666666667
A8: ECARTS - CLIENT OR | B8: - Administration | C8: 5772 | D8: 1316.42105263158 | E8: of:=[.D8]/[.C8] -> 0.228070175438597
A9: ECARTS - CLIENT OR | B9: - Conception | C9: 2754.44444444444 | D9: 7132.99415204678 | E9: of:=[.D9]/[.C9] -> 2.58963079340141
A10: ECARTS - CLIENT OR | B10: - Production | C10: 5860.8 | D10: 3621.03123877917 | E10: of:=[.D10]/[.C10] -> 0.617839072955769
A11: ECARTS - CLIENT OR | B11: Amortissements | C11: 1006.4 | D11: 52.9684210526317 | E11: of:=[.D11]/[.C11] -> 0.0526315789473685
A12: ECARTS - CLIENT CF | B12: - Film | C12: 350 | D12: 22 | E12: of:=[.D12]/[.C12] -> 0.0628571428571429
A13: ECARTS - CLIENT CF | B13: - Carton | C13: 3000 | D13: 1100 | E13: of:=[.D13]/[.C13] -> 0.366666666666667
A14: ECARTS - CLIENT CF | B14: - Consommables | C14: 60 | D14: -10 | E14: of:=[.D14]/[.C14] -> -0.166666666666667
A15: ECARTS - CLIENT CF | B15: - Imprimeur | C15: 6800 | D15: 0 | E15: of:=[.D15]/[.C15] -> 0
A16: ECARTS - CLIENT CF | B16: - Transport | C16: 820 | D16: 0 | E16: of:=[.D16]/[.C16] -> 0
A17: ECARTS - CLIENT CF | B17: - Autres charges | C17: 3000 | D17: 1817 | E17: of:=[.D17]/[.C17] -> 0.605666666666667
A18: ECARTS - CLIENT CF | B18: - Administration | C18: 5772 | D18: 6379.57894736842 | E18: of:=[.D18]/[.C18] -> 1.10526315789474
A19: ECARTS - CLIENT CF | B19: - Conception | C19: 3443.05555555556 | D19: 3245.50584795322 | E19: of:=[.D19]/[.C19] -> 0.942623723487824
A20: ECARTS - CLIENT CF | B20: - Production | C20: 4884 | D20: 2950.16876122083 | E20: of:=[.D20]/[.C20] -> 0.604047657907622
A21: ECARTS - CLIENT CF | B21: Amortissements | C21: 1006.4 | D21: 52.9684210526317 | E21: of:=[.D21]/[.C21] -> 0.0526315789473685

Sheet: Tables du pilote_source_de_donnÃ©es_POSTES_A_ANALYSER_1
A1: Filtrer
A3: dossier | B3: Ã©cart | C3: poste | D3: Ã©cart/prÃ©Ã©tabli x 100
A4: ECARTS - CLIENT OR | B4: 7132.99 | C4: - Conception | D4: 2.59 | E4: 7132.99415204678
B5: 3621.03 | C5: - Production | D5: 0.62 | E5: 3621.03123877917
B6: 1817 | C6: - Autres charges | D6: 0.61 | E6: 1817
B7: 1316.42 | C7: - Administration | D7: 0.23 | E7: 1316.42105263158
A8: ECARTS - CLIENT CF | B8: 6379.58 | C8: - Administration | D8: 1.11 | E8: 6379.57894736842
B9: 3245.51 | C9: - Conception | D9: 0.94 | E9: 3245.50584795322
B10: 2950.17 | C10: - Production | D10: 0.6 | E10: 2950.16876122083
B11: 1817 | C11: - Autres charges | D11: 0.61 | E11: 1817
B12: 1100 | C12: - Carton | D12: 0.37 | E12: 1100
A13: Total RÃ©sultat | E13: 29379.7

Sheet: repart ch du CR
A1: Film | B1: 6500 | D1: Charges | E1: directes
A2: Carton | B2: 100000 | D2: Charges | E2: directes
A3: Consommables | B3: 800 | C3: Charges directes
A4: Sous traitance | C4: 220000 | E4: Charges | F4: directes
A5: Autres Charges | C5: 60000 | E5: Charges | F5: indirectes
A6: Charges de personnel | D6: :
A7: Administration | B7: 115440 | D7: Charges | E7: indirectes
A8: Conception | B8: 99160 | D8: Charges | E8: indirectes
A9: Production | B9: 97680 | D9: Charges | E9: indirectes
A10: Amortissements | B10: 20128 | D10: Charges | E10: indirectes
I18: of:=5772/40000 -> 0.1443
I19: n

Sheet: Feuille5
A1: BUDGET FLEXIBLE DE L ATELIER A prod norm:10k pdts
A2: nbe uo (heures machine) | B2: 100000 | C2: 120000 | D2: 150000
A3: cf | B3: 850000 | C3: 850000 | D3: 850000
A4: cvar | B4: of:=51.5*[.B2] -> 5150000 | C4: of:=51.5*[.C2] -> 6180000 | D4: of:=51.5*[.D2] -> 7725000
A5: total | B5: of:=SUM([.B3:.B4]) -> 6000000 | C5: of:=SUM([.C3:.C4]) -> 7030000 | D5: of:=SUM([.D3:.D4]) -> 8575000
A6: ct uo dontÂ : | B6: of:=[.B5]/[.B2] -> 60 | C6: of:=[.C5]/[.C2] -> 58.5833333333333 | D6: of:=[.D5]/[.D2] -> 57.1666666666667
A7: cvar | B7: of:=[.B4]/[.B2] -> 51.5 | C7: of:=[.C4]/[.C2] -> 51.5 | D7: of:=[.D4]/[.D2] -> 51.5
A8: cf | B8: of:=[.B3]/[.B2] -> 8.5 | C8: of:=[.C3]/[.C2] -> 7.08333333333333 | D8: of:=[.D3]/[.D2] -> 5.66666666666667
A11: EG | B11: C(CC)PV | C11: '- | D11: C(Cp)PV | F11: '= | H11: of:=[.B12]-[.H12] -> 1860000
B12: 10500000 | D12: CuoP | E12: x | F12: NUOS-->pr | G12: '= | H12: of:=[.D13]*[.F13] -> 8640000
D13: 60 | F13: of:=120000/10000*12000 -> 144000
A14: E/B | B14: C(CC)PV | C14: '- | D14: BFLEX(AR) | F14: '= | H14: of:=[.B15]-[.F15] -> 2182500
B15: of:=[.B12] -> 10500000 | D15: AR | E15: '= | F15: of:=[.B7]*[.D16]+[.B3] -> 8317500
D16: 145000
A17: E/A | B17: CF*(AR-APPR) | C17: '= | D17: of:=([.B19]-[.C19])*[.B8] -> 8500
B18: AR | C18: APPR
B19: 145000 | C19: of:=120000/10000*12000 -> 144000
B20: BFLEX(AR) | C20: '- | D20: CPAR | E20: '= | F20: of:=[.B21]-[.H21] -> -382500
B21: of:=[.F15] -> 8317500 | D21: CUOp | E21: x | F21: AR | G21: '= | H21: of:=[.D22]*[.F22] -> 8700000
D22: of:=[.B6] -> 60 | F22: 145000
A23: E/R | B23: CPAR | E23: '- | F23: CPPR
B24: Cuop | C24: x | D24: AR | F24: Cuop | G24: x | H24: ApaAR
B25: of:=[.B6] -> 60 | D25: of:=145000 -> 145000 | F25: 60 | H25: of:=120000/10000*12000 -> 144000

Sheet: Feuille6
A1: Charges directes : | B1: OR | C1: CF | D1: GLOB
A2: â¢ Film | B2: 300 | C2: 372 | D2: Filmographe fa 1102003 global 672ok rÃ©part
A3: â¢ Carton | B3: 3 200 | C3: 4050 (erreur de saisie ou d'ennoncÃ©. La facture fait rÃ©fÃ©rence) 27k (et non 25200) Ã 0,15 | D3: Fa la cartonnerie 7250
A4: â¢ Imprimeur | B4: 6 000 | C4: 6 800 | D4: Fas 12002056 et 12002065
A5: â¢ Transport | B5: 750 | C5: 820 | D5: Fas colis rapide 12013256 et 12014002
A6: â¢ Consommabl | B6: 30 | C6: 50

Sheet: Feuille7
A1: CTS PREETABLISÂ : VENTILATION DES CH INDIRECTES ANNUELLES VERS OR ET CF
A2: nom de la ch | B2: calcul cup | F2: nuo | H2: CH ATTRIBUEE
B3: mode calcul Ct uo | C3: calcul | E3: RÃ©sultatÂ : Cup
C4: numerateur | D4: denominateur
C5: Ch Ã repart | D5: nb uo tot | F5: or | G5: cf | H5: OR | I5: CF
A6: - Autres charges | B6: ct d'un dosÂ : Ch tot / Nb dos | C6: 60000 | D6: 20 | E6: of:=[.C6]/[.$D6] -> 3000 | F6: 1 | G6: 1 | H6: of:=[.E6]*[.F6] -> 3000 | I6: of:=[.E6]*[.G6] -> 3000
A7: - Administration | B7: Ct gest admin d'un eu de caÂ | C7: 115440 | D7: 800000 | E7: of:=[.C7]/[.$D7] -> 0.1443 | F7: 40000 | G7: 40000 | H7: of:=[.E7]*[.F7] -> 5772 | I7: of:=[.E7]*[.G7] -> 5772
A8: - Conception | B8: Ct 1 jour de Conception | C8: 99160 | D8: 360 | E8: of:=[.C8]/[.$D8] -> 275.444444444444 | F8: 10 | G8: 12.5 | H8: of:=[.E8]*[.F8] -> 2754.44444444444 | I8: of:=[.E8]*[.G8] -> 3443.05555555556
A9: - Production | B9: Ct prod 1 affiche | C9: 97680 | D9: 500000 | E9: of:=[.C9]/[.$D9] -> 0.19536 | F9: 30000 | G9: 25000 | H9: of:=[.E9]*[.F9] -> 5860.8 | I9: of:=[.E9]*[.G9] -> 4884
A10: Amortissements | B10: Ct amort supp P/ 1 dossier | C10: 20128 | D10: 20 | E10: of:=[.C10]/[.$D10] -> 1006.4 | F10: 1 | G10: 1 | H10: of:=[.E10]*[.F10] -> 1006.4 | I10: of:=[.E10]*[.G10] -> 1006.4

Sheet: Feuille8
A1: CTS REELSÂ : VENTILATION DES CH INDIRECTES COMMUNES AUX DEUX DOSSIERS VERS OR ET CF
A2: nom de La ch | B2: Montant Ch commune Ã rÃ©part | C2: COUT REEL DE L UNITE D OEUVRE | G2: NOMBRE D UO CONSO C | I2: CH ATTRIBUEE
C3: mode Calcul | D3: calcul | F3: Resultat Cuo R
D4: numerateur Ch communes | E4: denominateur Nb uo communes
G5: or | H5: cf | I5: OR | J5: CF
A6: - Autres Charges | B6: 9634 | C6: ct d'un dosÂ : Ch tot / Nb dos | D6: 9634 | E6: 2 | F6: of:=[.D6]/[.E6] -> 4817 | G6: 1 | H6: 1 | I6: of:=[.F6]*[.G6] -> 4817 | J6: of:=[.F6]*[.H6] -> 4817
A7: - Admin Istration | B7: 19240 | C7: Ct gest admin d'un eu de caÂ | D7: 19240 | E7: 95000 | F7: of:=[.D7]/[.E7] -> 0.202526315789474 | G7: 35000 | H7: 60000 | I7: of:=[.F7]*[.G7] -> 7088.42105263158 | J7: of:=[.F7]*[.H7] -> 12151.5789473684
A8: - Con Ception | B8: 16576 | C8: Ct 1 jour de Conception | D8: 16576 | E8: 57 | F8: of:=[.D8]/[.E8] -> 290.80701754386 | G8: 34 | H8: 23 | I8: of:=[.F8]*[.G8] -> 9887.43859649123 | J8: of:=[.F8]*[.H8] -> 6688.56140350877
A9: - Prod Uction | B9: 17316 | C9: Ct prod 1 affiche | D9: 17316 | E9: 55700 | F9: of:=[.D9]/[.E9] -> 0.310879712746858 | G9: 30500 | H9: 25200 | I9: of:=[.F9]*[.G9] -> 9481.83123877917 | J9: of:=[.F9]*[.H9] -> 7834.16876122083
A10: Amort Issements | B10: 20128 | C10: Ct amort supp P/ 1 dossier | D10: 20128 | E10: 19 | F10: of:=[.D10]/[.E10] -> 1059.36842105263 | G10: 1 | H10: 1 | I10: of:=[.F10]*[.G10] -> 1059.36842105263 | J10: of:=[.F10]*[.H10] -> 1059.36842105263

Sheet: Feuille9
A1: CTS PREETABLISÂ : VENTILATION DES CH INDIRECTES ANNUELLES VERS OR ET CF | K1: CTS REELSÂ : VENTILATION DES CH INDIRECTES COMMUNES AUX DEUX DOSSIERS VERS OR ET CF | V1: ANALYSE DE L ECART GLOBAL
A2: nom de la ch | B2: calcul cup | F2: nuo | H2: CH ATTRIBUEE | K2: nom de La ch | L2: Montant Ch commune Ã rÃ©part | M2: COUT REEL DE L UNITE D OEUVRE | Q2: NOMBRE D UO CONSO C | S2: CH ATTRIBUEE | V2: NOM DE LA CHARGE | W2: EG | Y2: TYPE DE CHARGE
B3: mode calcul Ct uo | C3: calcul | E3: RÃ©sultatÂ : Cup | M3: mode Calcul | N3: calcul | P3: Resultat Cuo R | AD3: BFLEX(cc) | AG3: RESULTATÂ : E/B | AK3: C(cc)_cup | AM3: RESULTATÂ : E/A | AO3: RESULTATÂ : E/R | AQ3: CRCÂ : EG = E/R + E/A + E/B
C4: numerateur | D4: denominateur | N4: numerateur Ch communes | O4: denominateur Nb uo communes | Z4: C(cc[PV]) | AB4: CC | AD4: EQ DE BFLEX | AE4: RESULTAT | AI4: cc
C5: Ch Ã repart | D5: nb uo tot | F5: or | G5: cf | H5: OR | I5: CF | Q5: or | R5: cf | S5: OR | T5: CF | W5: OR | X5: CF | Z5: OR | AA5: CF | AB5: OR | AC5: CF | AE5: OR | AF5: CF | AG5: OR | AH5: CF | AI5: OR | AJ5: CF | AK5: OR | AL5: CF | AM5: OR | AN5: CF | AO5: OR | AP5: CF | AQ5: EG OR | AR5: CUMUL OR | AS5: EG CF | AT5: CUMUL CF
A6: - Autres charges | B6: ct d'un dosÂ : Ch tot / Nb dos | C6: 60000 | D6: 20 | E6: of:=[.C6]/[.$D6] -> 3000 | F6: 1 | G6: 1 | H6: of:=[.E6]*[.F6] -> 3000 | I6: of:=[.E6]*[.G6] -> 3000 | K6: - Autres Charges | L6: 9634 | M6: ct d'un dosÂ : Ch tot / Nb dos | N6: 9634 | O6: 2 | P6: of:=[.N6]/[.O6] -> 4817 | Q6: 1 | R6: 1 | S6: of:=[.P6]*[.Q6] -> 4817 | T6: of:=[.P6]*[.R6] -> 4817 | V6: - Autres Charges | W6: of:=[.S6]-[.H6] -> 1817 | X6: of:=[.T6]-[.I6] -> 1817 | Y6: CF PURE | Z6: of:=[.S6] -> 4817 | AA6: of:=[.T6] -> 4817 | AB6: of:=[.Q6] -> 1 | AC6: of:=[.R6] -> 1 | AD6: of:=3000 -> 3000 | AE6: of:=IF([.Y6]="CF PURE";[.AD6];[.AD6]*[.AB6]) -> 3000 | AF6: of:=IF([.Y6]="CF PURE";[.AD6];[.AD6]*[.AC6]) -> 3000 | AG6: of:=[.Z6]-[.AE6] -> 1817 | AH6: of:=[.AA6]-[.AF6] -> 1817 | AI6: 1 | AJ6: 1 | AK6: of:=[.AI6]*[.E6] -> 3000 | AL6: of:=[.AJ6]*[.E6] -> 3000 | AM6: of:=[.AE6]-[.AK6] -> 0 | AN6: of:=[.AF6]-[.AL6] -> 0 | AO6: of:=[.AK6]-[.H6] -> 0 | AP6: of:=[.AL6]-[.I6] -> 0 | AQ6: of:=[.W6] -> 1817 | AR6: of:=[.AO6]+[.AM6]+[.AG6] -> 1817 | AS6: of:=[.X6] -> 1817 | AT6: of:=[.AP6]+[.AN6]+[.AH6] -> 1817
A7: - Administration | B7: Ct gest admin d'un eu de caÂ | C7: 115440 | D7: 800000 | E7: of:=[.C7]/[.$D7] -> 0.1443 | F7: 40000 | G7: 40000 | H7: of:=[.E7]*[.F7] -> 5772 | I7: of:=[.E7]*[.G7] -> 5772 | K7: - Admin Istration | L7: 19240 | M7: Ct gest admin d'un eu de caÂ | N7: 19240 | O7: 95000 | P7: of:=[.N7]/[.O7] -> 0.202526315789474 | Q7: 35000 | R7: 60000 | S7: of:=[.P7]*[.Q7] -> 7088.42105263158 | T7: of:=[.P7]*[.R7] -> 12151.5789473684 | V7: - Admin Istration | W7: of:=[.S7]-[.H7] -> 1316.42105263158 | X7: of:=[.T7]-[.I7] -> 6379.57894736842 | Y7: CVAR PURE | Z7: of:=[.S7] -> 7088.42105263158 | AA7: of:=[.T7] -> 12151.5789473684 | AB7: of:=[.Q7] -> 35000 | AC7: of:=[.R7] -> 60000 | AD7: 0.1449 | AE7: of:=IF([.Y7]="CF PURE";[.AD7];[.AD7]*[.AB7]) -> 5071.5 | AF7: of:=IF([.Y7]="CF PURE";[.AD7];[.AD7]*[.AC7]) -> 8694 | AG7: of:=[.Z7]-[.AE7] -> 2016.92105263158 | AH7: of:=[.AA7]-[.AF7] -> 3457.57894736842 | AI7: 35000 | AJ7: 60000 | AK7: of:=[.AI7]*[.E7] -> 5050.5 | AL7: of:=[.AJ7]*[.E7] -> 8658 | AM7: of:=[.AE7]-[.AK7] -> 21 | AN7: of:=[.AF7]-[.AL7] -> 36 | AO7: of:=[.AK7]-[.H7] -> -721.500000000001 | AP7: of:=[.AL7]-[.I7] -> 2886 | AQ7: of:=[.W7] -> 1316.42105263158 | AR7: of:=[.AO7]+[.AM7]+[.AG7] -> 1316.42105263158 | AS7: of:=[.X7] -> 6379.57894736842 | AT7: of:=[.AP7]+[.AN7]+[.AH7] -> 6379.57894736842
A8: - Conception | B8: Ct 1 jour de Conception | C8: 99160 | D8: 360 | E8: of:=[.C8]/[.$D8] -> 275.444444444444 | F8: 10 | G8: 12.5 | H8: of:=[.E8]*[.F8] -> 2754.44444444444 | I8: of:=[.E8]*[.G8] -> 3443.05555555556 | K8: - Con Ception | L8: 16576 | M8: Ct 1 jour de Conception | N8: 16576 | O8: 57 | P8: of:=[.N8]/[.O8] -> 290.80701754386 | Q8: 34 | R8: 23 | S8: of:=[.P8]*[.Q8] -> 9887.43859649123 | T8: of:=[.P8]*[.R8] -> 6688.56140350877 | V8: - Con Ception | W8: of:=[.S8]-[.H8] -> 7132.99415204679 | X8: of:=[.T8]-[.I8] -> 3245.50584795322 | Y8: CVAR PURE | Z8: of:=[.S8] -> 9887.43859649123 | AA8: of:=[.T8] -> 6688.56140350877 | AB8: of:=[.Q8] -> 34 | AC8: of:=[.R8] -> 23 | AD8: 275.44 | AE8: of:=IF([.Y8]="CF PURE";[.AD8];[.AD8]*[.AB8]) -> 9364.96 | AF8: of:=IF([.Y8]="CF PURE";[.AD8];[.AD8]*[.AC8]) -> 6335.12 | AG8: of:=[.Z8]-[.AE8] -> 522.47859649123 | AH8: of:=[.AA8]-[.AF8] -> 353.441403508773 | AI8: 34 | AJ8: 23 | AK8: of:=[.AI8]*[.E8] -> 9365.11111111111 | AL8: of:=[.AJ8]*[.E8] -> 6335.22222222222 | AM8: of:=[.AE8]-[.AK8] -> -0.151111111112186 | AN8: of:=[.AF8]-[.AL8] -> -0.102222222222736 | AO8: of:=[.AK8]-[.H8] -> 6610.66666666667 | AP8: of:=[.AL8]-[.I8] -> 2892.16666666667 | AQ8: of:=[.W8] -> 7132.99415204679 | AR8: of:=[.AO8]+[.AM8]+[.AG8] -> 7132.99415204679 | AS8: of:=[.X8] -> 3245.50584795322 | AT8: of:=[.AP8]+[.AN8]+[.AH8] -> 3245.50584795322
A9: - Production | B9: Ct prod 1 affiche | C9: 97680 | D9: 500000 | E9: of:=[.C9]/[.$D9] -> 0.19536 | F9: 30000 | G9: 25000 | H9: of:=[.E9]*[.F9] -> 5860.8 | I9: of:=[.E9]*[.G9] -> 4884 | K9: - Prod Uction | L9: 17316 | M9: Ct prod 1 affiche | N9: 17316 | O9: 55700 | P9: of:=[.N9]/[.O9] -> 0.310879712746858 | Q9: 30500 | R9: 25200 | S9: of:=[.P9]*[.Q9] -> 9481.83123877917 | T9: of:=[.P9]*[.R9] -> 7834.16876122083 | V9: - Prod Uction | W9: of:=[.S9]-[.H9] -> 3621.03123877917 | X9: of:=[.T9]-[.I9] -> 2950.16876122083 | Y9: CVAR PURE | Z9: of:=[.S9] -> 9481.83123877917 | AA9: of:=[.T9] -> 7834.16876122083 | AB9: of:=[.Q9] -> 30500 | AC9: of:=[.R9] -> 25200 | AD9: 0.1954 | AE9: of:=IF([.Y9]="CF PURE";[.AD9];[.AD9]*[.AB9]) -> 5959.7 | AF9: of:=IF([.Y9]="CF PURE";[.AD9];[.AD9]*[.AC9]) -> 4924.08 | AG9: of:=[.Z9]-[.AE9] -> 3522.13123877917 | AH9: of:=[.AA9]-[.AF9] -> 2910.08876122082 | AI9: 30500 | AJ9: 25200 | AK9: of:=[.AI9]*[.E9] -> 5958.48 | AL9: of:=[.AJ9]*[.E9] -> 4923.072 | AM9: of:=[.AE9]-[.AK9] -> 1.22000000000025 | AN9: of:=[.AF9]-[.AL9] -> 1.00800000000072 | AO9: of:=[.AK9]-[.H9] -> 97.6800000000003 | AP9: of:=[.AL9]-[.I9] -> 39.0720000000001 | AQ9: of:=[.W9] -> 3621.03123877917 | AR9: of:=[.AO9]+[.AM9]+[.AG9] -> 3621.03123877917 | AS9: of:=[.X9] -> 2950.16876122083 | AT9: of:=[.AP9]+[.AN9]+[.AH9] -> 2950.16876122083
A10: Amortissements | B10: Ct amort supp P/ 1 dossier | C10: 20128 | D10: 20 | E10: of:=[.C10]/[.$D10] -> 1006.4 | F10: 1 | G10: 1 | H10: of:=[.E10]*[.F10] -> 1006.4 | I10: of:=[.E10]*[.G10] -> 1006.4 | K10: Amort Issements | L10: 20128 | M10: Ct amort supp P/ 1 dossier | N10: 20128 | O10: 19 | P10: of:=[.N10]/[.O10] -> 1059.36842105263 | Q10: 1 | R10: 1 | S10: of:=[.P10]*[.Q10] -> 1059.36842105263 | T10: of:=[.P10]*[.R10] -> 1059.36842105263 | V10: Amort Issements | W10: of:=[.S10]-[.H10] -> 52.9684210526317 | X10: of:=[.T10]-[.I10] -> 52.9684210526317 | Y10: CF PURE | Z10: of:=[.S10] -> 1059.36842105263 | AA10: of:=[.T10] -> 1059.36842105263 | AB10: of:=[.Q10] -> 1 | AC10: of:=[.R10] -> 1 | AD10: x | AI10: 1 | AJ10: 1